{"artifact_class":"officer_profile_definition","content_digest":"sha256:da2b8b062a4a8778c5cdea47a675748b43d6799d4151effed50250e1c4bc0e79","contract_version":"1.0.0","definition_id":"guildhall.guildmaster","definition_version":"1.0.0","digest_spec":{"algorithm":"sha256","canonicalization":"rfc8785","omitted_fields":["content_digest"]},"limitations":["not a Profile","not installable","grants no Seat or mission authority"],"qualification_contract":{"contract_id":"qualification.guildhall.guildmaster.v1","criteria":["exact definition and Profile installation","declared jurisdiction restraint","version and provenance preservation"]},"source":{"content_digest":"sha256:00378d36a50e11dba0e7181c06a93902b5008d9bac97d51a4f10bf03914d41c5","path":"offices/guildhall/profile-guildmaster.md"},"steward":{"id":"guildhall","kind":"office"},"target":{"id":"guildhall.guildmaster","kind":"seat"}}
