{"artifact_class":"officer_profile_definition","content_digest":"sha256:ff66d245403d893f8e59724ae94768867f3a9cee759243d8f3b37f0f722a32c7","contract_version":"1.0.0","definition_id":"guildhall.committee.disciplinary-fit","definition_version":"1.0.0","digest_spec":{"algorithm":"sha256","canonicalization":"rfc8785","omitted_fields":["content_digest"]},"limitations":["not a Profile","not installable","grants no Seat or mission authority"],"qualification_contract":{"contract_id":"qualification.guildhall.committee.disciplinary-fit.v1","criteria":["exact definition and Profile installation","declared jurisdiction restraint","version and provenance preservation"]},"source":{"content_digest":"sha256:ad483da7439bdbbb93170a1c98bdc425477f68874bc37857bdbb89f109161d4b","path":"offices/guildhall/profile-committee-disciplinary-fit.md"},"steward":{"id":"guildhall","kind":"office"},"target":{"id":"guildhall.committee.disciplinary-fit","kind":"seat"}}
