{"artifact_class":"officer_profile_definition","content_digest":"sha256:3b76c71dfc91a1ccaefcd42380f3b75b662a95eb5f308326511d2a773b538393","contract_version":"1.0.0","definition_id":"guildhall.committee.composition","definition_version":"1.0.0","digest_spec":{"algorithm":"sha256","canonicalization":"rfc8785","omitted_fields":["content_digest"]},"limitations":["not a Profile","not installable","grants no Seat or mission authority"],"qualification_contract":{"contract_id":"qualification.guildhall.committee.composition.v1","criteria":["exact definition and Profile installation","declared jurisdiction restraint","version and provenance preservation"]},"source":{"content_digest":"sha256:3ad3fc6812006e8b8a645e04ac025fb636008420370f0f01cff246040d85ed02","path":"offices/guildhall/profile-committee-composition.md"},"steward":{"id":"guildhall","kind":"office"},"target":{"id":"guildhall.committee.composition","kind":"seat"}}
