{"artifact_class":"officer_profile_definition","content_digest":"sha256:9128a6149160c9aa7cdf4675aa9f831431ba65903fd52b4d4c7d0e29582022d8","contract_version":"1.0.0","definition_id":"guildhall.committee.boundary-challenge","definition_version":"1.0.0","digest_spec":{"algorithm":"sha256","canonicalization":"rfc8785","omitted_fields":["content_digest"]},"limitations":["not a Profile","not installable","grants no Seat or mission authority"],"qualification_contract":{"contract_id":"qualification.guildhall.committee.boundary-challenge.v1","criteria":["exact definition and Profile installation","declared jurisdiction restraint","version and provenance preservation"]},"source":{"content_digest":"sha256:e445f9a0fae6ffad85f5beaeb2fef26936afb90d5a4eb6228189c1c99f8b11bb","path":"offices/guildhall/profile-committee-boundary-challenge.md"},"steward":{"id":"guildhall","kind":"office"},"target":{"id":"guildhall.committee.boundary-challenge","kind":"seat"}}
